{
  "id": "env-langsec-001",
  "timestamp": "2026-03-22T10:07:00Z",
  "src": "orchestrator",
  "dst": "lg_a_langsec",
  "verb": "security.scan_prompt",
  "payload": {
    "content": "Review this local prompt for prompt injection attempts and redact secrets.",
    "content_type": "prompt",
    "policy_mode": "strict",
    "redact_fields": ["password", "token"],
    "caller_risk": "medium"
  },
  "budget": {
    "max_tokens": 600,
    "max_ms": 1500,
    "priority": "high",
    "max_depth": 1,
    "cost_center": "security"
  },
  "signature": {
    "algorithm": "ed25519",
    "key_id": "orchestrator-key",
    "value": "fedcba9876543210fedcba9876543210fedcba9876543210fedcba9876543210"
  },
  "schema_version": "1.0.0"
}
